{
  "version": 1,
  "title": {
    "text": "一种时间序列预测模型部署期可信自适应控制方法及装置",
    "line": 1
  },
  "books": {
    "abstract": {
      "offset": 3,
      "length": 3
    },
    "claims": {
      "offset": 7,
      "length": 37
    },
    "description": {
      "offset": 45,
      "length": 244
    }
  },
  "abstract": {
    "id": "abstract",
    "kind": "abstract",
    "lines": {
      "start": 1,
      "end": 3
    },
    "figure_num": 1,
    "paragraphs": [
      {
        "id": "abstract/p1",
        "kind": "paragraph",
        "lines": {
          "start": 2,
          "end": 2
        },
        "text": "本发明公开了一种时间序列预测模型部署期可信自适应控制方法及装置。方法包括：冻结基础预测模型并设定安全锚输出；维护成熟反馈队列，仅当预测起点的完整地平线目标观测成熟后才计算成熟超额损失并纳入在线统计，防止未来信息泄漏；由成熟统计驱动的信任系数对自适应修正分支进行门控或收缩，输出为安全锚与修正分支的凸组合；以裁剪成熟超额损失构造e过程统计量，任意停时越阈即告警并自动回退安全锚。修正信号可为检索记忆或外生协变量，均由同一信任协议保证部署期可信性：修正信号可靠时保留精度收益，失效时预测损失被控制在安全锚附近。",
        "para_no": null,
        "role": "body",
        "inline": [
          {
            "text": "本发明公开了一种时间序列预测模型部署期可信自适应控制方法及装置。方法包括：冻结基础预测模型并设定安全锚输出；维护成熟反馈队列，仅当预测起点的完整地平线目标观测成熟后才计算成熟超额损失并纳入在线统计，防止未来信息泄漏；由成熟统计驱动的信任系数对自适应修正分支进行门控或收缩，输出为安全锚与修正分支的凸组合；以裁剪成熟超额损失构造e过程统计量，任意停时越阈即告警并自动回退安全锚。修正信号可为检索记忆或外生协变量，均由同一信任协议保证部署期可信性：修正信号可靠时保留精度收益，失效时预测损失被控制在安全锚附近。",
            "marks": []
          }
        ]
      }
    ]
  },
  "claims": [
    {
      "id": "claims/1",
      "kind": "claim",
      "lines": {
        "start": 2,
        "end": 6
      },
      "num": 1,
      "num_written": "1",
      "claim_kind": "independent",
      "category": "时间序列预测模型部署期可信自适应控制方法",
      "refs": [],
      "charact": {
        "seg": 0,
        "offset": 31
      },
      "segments": [
        {
          "id": "claims/1/seg/0",
          "kind": "text",
          "text": "1.一种时间序列预测模型部署期可信自适应控制方法，其特征在于，所述方法包括以下步骤：",
          "line": 2,
          "mathml": null,
          "inline": [
            {
              "text": "1.一种时间序列预测模型部署期可信自适应控制方法，其特征在于，所述方法包括以下步骤：",
              "marks": []
            }
          ]
        },
        {
          "id": "claims/1/seg/1",
          "kind": "text",
          "text": "步骤一，冻结基础预测模型：将离线训练完成的基础预测模型装载并冻结得到冻结基础预测模型，部署期不更新所述冻结基础预测模型的参数、不对所述冻结基础预测模型进行梯度反向传播，并设定安全锚输出；所述基础预测模型为仅以目标序列历史为输入的纯内生模型，或包括仅以目标序列历史为输入的内生分支与以外生协变量为输入的协变量分支；所述安全锚输出为所述冻结基础预测模型的预测输出或所述内生分支的预测输出；",
          "line": 3,
          "mathml": null,
          "inline": [
            {
              "text": "步骤一，冻结基础预测模型：将离线训练完成的基础预测模型装载并冻结得到冻结基础预测模型，部署期不更新所述冻结基础预测模型的参数、不对所述冻结基础预测模型进行梯度反向传播，并设定安全锚输出；所述基础预测模型为仅以目标序列历史为输入的纯内生模型，或包括仅以目标序列历史为输入的内生分支与以外生协变量为输入的协变量分支；所述安全锚输出为所述冻结基础预测模型的预测输出或所述内生分支的预测输出；",
              "marks": []
            }
          ]
        },
        {
          "id": "claims/1/seg/2",
          "kind": "text",
          "text": "步骤二，成熟反馈结算：维护成熟反馈队列，在每个预测起点发出预测时将该起点挂起入所述成熟反馈队列的待定队列；仅当某起点s的完整预测地平线目标已被观测、即满足 s ≤ t − H − d 时，将其作为成熟记录结算，计算该起点的成熟损失并纳入在线统计，所述成熟损失至少包括受控预测输出相对所述安全锚输出的成熟超额损失，以及所述安全锚输出与自适应修正分支输出各自的成熟损失，其中t为当前时刻，H为预测地平线长度，d为上报延迟；",
          "line": 4,
          "mathml": null,
          "inline": [
            {
              "text": "步骤二，成熟反馈结算：维护成熟反馈队列，在每个预测起点发出预测时将该起点挂起入所述成熟反馈队列的待定队列；仅当某起点s的完整预测地平线目标已被观测、即满足 s ≤ t − H − d 时，将其作为成熟记录结算，计算该起点的成熟损失并纳入在线统计，所述成熟损失至少包括受控预测输出相对所述安全锚输出的成熟超额损失，以及所述安全锚输出与自适应修正分支输出各自的成熟损失，其中t为当前时刻，H为预测地平线长度，d为上报延迟；",
              "marks": []
            }
          ]
        },
        {
          "id": "claims/1/seg/3",
          "kind": "text",
          "text": "步骤三，信任门控融合：由所述成熟反馈结算得到的成熟统计驱动取值于区间[0,1]的信任系数，以所述信任系数对所述自适应修正分支的介入程度进行门控和/或对其输入进行收缩，所述自适应修正分支的修正信号来自检索记忆和/或外生协变量；输出为所述安全锚输出与所述自适应修正分支输出以所述信任系数中的门控分量为权重的凸组合，该凸组合作为受控预测输出；",
          "line": 5,
          "mathml": null,
          "inline": [
            {
              "text": "步骤三，信任门控融合：由所述成熟反馈结算得到的成熟统计驱动取值于区间[0,1]的信任系数，以所述信任系数对所述自适应修正分支的介入程度进行门控和/或对其输入进行收缩，所述自适应修正分支的修正信号来自检索记忆和/或外生协变量；输出为所述安全锚输出与所述自适应修正分支输出以所述信任系数中的门控分量为权重的凸组合，该凸组合作为受控预测输出；",
              "marks": []
            }
          ]
        },
        {
          "id": "claims/1/seg/4",
          "kind": "text",
          "text": "步骤四，e过程监控回退：将各成熟记录的成熟超额损失裁剪到预设界±b内得到裁剪成熟超额损失，以所述裁剪成熟超额损失在固定正数格点集合上构造混合指数e过程统计量，并逐成熟记录增量更新；当所述统计量达到或越过由预设显著性水平α确定的阈值1/α时发出告警，并将对外输出的所述受控预测输出自动回退为所述安全锚输出；步骤三的信任系数与步骤四的e过程统计量所依赖的已实现目标均仅经由步骤二的成熟结算获得，二者共享同一成熟反馈队列。",
          "line": 6,
          "mathml": null,
          "inline": [
            {
              "text": "步骤四，e过程监控回退：将各成熟记录的成熟超额损失裁剪到预设界±b内得到裁剪成熟超额损失，以所述裁剪成熟超额损失在固定正数格点集合上构造混合指数e过程统计量，并逐成熟记录增量更新；当所述统计量达到或越过由预设显著性水平α确定的阈值1/α时发出告警，并将对外输出的所述受控预测输出自动回退为所述安全锚输出；步骤三的信任系数与步骤四的e过程统计量所依赖的已实现目标均仅经由步骤二的成熟结算获得，二者共享同一成熟反馈队列。",
              "marks": []
            }
          ]
        }
      ]
    },
    {
      "id": "claims/2",
      "kind": "claim",
      "lines": {
        "start": 8,
        "end": 8
      },
      "num": 2,
      "num_written": "2",
      "claim_kind": "dependent",
      "category": "方法",
      "refs": [
        {
          "text": "权利要求1",
          "targets": [
            1
          ],
          "alternative": false,
          "seg": 0,
          "start": 4,
          "end": 9
        }
      ],
      "charact": {
        "seg": 0,
        "offset": 21
      },
      "segments": [
        {
          "id": "claims/2/seg/0",
          "kind": "text",
          "text": "2.根据权利要求1所述的方法，其特征在于，所述自适应修正分支为检索记忆分支：对目标序列每个通道以滑动窗口从训练段构建键与未来片段对的记忆库，其中键为形状归一化的上下文窗口，未来片段经末值锚定与尺度归一化；在每个预测起点对每个通道以归一化查询上下文从所述记忆库检索前k个相似片段，加权重构得到检索预测与检索置信度；所述信任系数为双因子门控权重，如下式所示：",
          "line": 8,
          "mathml": null,
          "inline": [
            {
              "text": "2.根据权利要求1所述的方法，其特征在于，所述自适应修正分支为检索记忆分支：对目标序列每个通道以滑动窗口从训练段构建键与未来片段对的记忆库，其中键为形状归一化的上下文窗口，未来片段经末值锚定与尺度归一化；在每个预测起点对每个通道以归一化查询上下文从所述记忆库检索前k个相似片段，加权重构得到检索预测与检索置信度；所述信任系数为双因子门控权重，如下式所示：",
              "marks": []
            }
          ]
        }
      ]
    }
  ],
  "description": [
    {
      "id": "description/技术领域",
      "kind": "section",
      "lines": {
        "start": 2,
        "end": 2
      },
      "title": "技术领域",
      "part": "technical-field",
      "inline": [
        {
          "text": "技术领域",
          "marks": []
        }
      ]
    },
    {
      "id": "description/技术领域/p0001",
      "kind": "paragraph",
      "lines": {
        "start": 4,
        "end": 4
      },
      "text": "本发明涉及时间序列预测与机器学习模型部署技术领域，尤其涉及一种在时间序列预测模型冻结部署、反馈延迟到达的条件下，对自适应修正分支的介入程度进行可信控制、监控与自动降级的方法及装置。",
      "para_no": 1,
      "role": "body",
      "inline": [
        {
          "text": "本发明涉及时间序列预测与机器学习模型部署技术领域，尤其涉及一种在时间序列预测模型冻结部署、反馈延迟到达的条件下，对自适应修正分支的介入程度进行可信控制、监控与自动降级的方法及装置。",
          "marks": []
        }
      ]
    },
    {
      "id": "description/发明内容",
      "kind": "section",
      "lines": {
        "start": 24,
        "end": 24
      },
      "title": "发明内容",
      "part": "disclosure",
      "inline": [
        {
          "text": "发明内容",
          "marks": []
        }
      ]
    },
    {
      "id": "description/发明内容/技术方案",
      "kind": "subsection",
      "lines": {
        "start": 30,
        "end": 30
      },
      "title": "技术方案",
      "part": "disclosure",
      "inline": [
        {
          "text": "技术方案",
          "marks": []
        }
      ]
    },
    {
      "id": "description/发明内容/技术方案/p0013",
      "kind": "paragraph",
      "lines": {
        "start": 36,
        "end": 36
      },
      "text": "步骤S2，成熟反馈结算：维护成熟反馈队列，在每个预测起点发出预测时将该起点连同其元数据（各分支预测、门控特征等）挂起入成熟反馈队列的待定队列；仅当某起点s的完整预测地平线目标已被观测、即满足式（1）所示成熟条件时（t为当前时刻，H为预测地平线长度，d为额外上报延迟），将其作为成熟记录结算：计算受控预测输出相对安全锚输出的成熟超额损失，并将成熟统计纳入在线统计更新。作为可选的实施方式，可为待定队列设置最大容忍迟到时长与缺失比例阈值：超过最大容忍迟到时长仍未观测到完整目标的起点被标记为失效并移出待定队列、不进入任何在线统计；目标窗口含缺失值时仅对已观测位置计算成熟损失，缺失比例超过阈值的窗口同样标记为失效。",
      "para_no": 13,
      "role": "body",
      "inline": [
        {
          "text": "步骤S2，成熟反馈结算：维护成熟反馈队列，在每个预测起点发出预测时将该起点连同其元数据（各分支预测、门控特征等）挂起入成熟反馈队列的待定队列；仅当某起点s的完整预测地平线目标已被观测、即满足式（1）所示成熟条件时（t为当前时刻，H为预测地平线长度，d为额外上报延迟），将其作为成熟记录结算：计算受控预测输出相对安全锚输出的成熟超额损失，并将成熟统计纳入在线统计更新。作为可选的实施方式，可为待定队列设置最大容忍迟到时长与缺失比例阈值：超过最大容忍迟到时长仍未观测到完整目标的起点被标记为失效并移出待定队列、不进入任何在线统计；目标窗口含缺失值时仅对已观测位置计算成熟损失，缺失比例超过阈值的窗口同样标记为失效。",
          "marks": []
        }
      ]
    },
    {
      "id": "description/发明内容/技术方案/eq1",
      "kind": "equation",
      "lines": {
        "start": 38,
        "end": 38
      },
      "source": "s ≤ t − H − d",
      "label": "（1）",
      "mathml": null,
      "anchor_para_no": 13
    }
  ],
  "figures": [
    {
      "id": "figures/1",
      "kind": "figure",
      "book": "figures",
      "num": 1,
      "file": "fig1.emf",
      "width": 15.0,
      "alt": "图1 本发明实施例的信任协议闭环总体流程图",
      "caption": "本发明实施例的信任协议闭环总体流程图",
      "caption_line": 116
    }
  ]
}
