{
 "version": 1,
 "title": {
  "text": "神经网络模型的可视化建模方法和装置",
  "line": 1
 },
 "books": {
  "abstract": {
   "offset": 3,
   "length": 3
  },
  "claims": {
   "offset": 7,
   "length": 7
  },
  "description": {
   "offset": 15,
   "length": 532
  }
 },
 "abstract": {
  "id": "abstract",
  "kind": "abstract",
  "lines": {
   "start": 1,
   "end": 3
  },
  "figure_num": 1,
  "paragraphs": [
   {
    "id": "abstract/p1",
    "kind": "paragraph",
    "lines": {
     "start": 2,
     "end": 2
    },
    "text": "本发明提供了神经网络模型的可视化建模方法和装置，通过为深度学习框架中的各个运算方法与各个对象/实例构建映射关系，并为各个对象/实例构建对应的可视化控件，并将输入输出关系映射为可视化有向弧，当接收到对至少一个可视化控件的操作时，根据操作的每一个可视化控件对应的对象/实例以及映射关系，确定节点集合；当接收到对至少一个可视化有向弧的操作时，根据操作的每一个所述可视化有向弧和所述输入输出关系，确定依赖关系集合；当接收到建模请求时，初始化预先构建的源码文件；基于深度学习框架和初始化后的源码文件，利用节点集合和依赖关系集合，生成对应的神经网络模型。本发明提供的方案实现了对神经网络模型进行可视化构建。",
    "para_no": null,
    "role": "body",
    "inline": [
     {
      "text": "本发明提供了神经网络模型的可视化建模方法和装置，通过为深度学习框架中的各个运算方法与各个对象/实例构建映射关系，并为各个对象/实例构建对应的可视化控件，并将输入输出关系映射为可视化有向弧，当接收到对至少一个可视化控件的操作时，根据操作的每一个可视化控件对应的对象/实例以及映射关系，确定节点集合；当接收到对至少一个可视化有向弧的操作时，根据操作的每一个所述可视化有向弧和所述输入输出关系，确定依赖关系集合；当接收到建模请求时，初始化预先构建的源码文件；基于深度学习框架和初始化后的源码文件，利用节点集合和依赖关系集合，生成对应的神经网络模型。本发明提供的方案实现了对神经网络模型进行可视化构建。",
      "marks": []
     }
    ]
   }
  ]
 },
 "claims": [
  {
   "id": "claims/1",
   "kind": "claim",
   "lines": {
    "start": 2,
    "end": 2
   },
   "num": 1,
   "num_written": "1",
   "claim_kind": "independent",
   "category": null,
   "refs": [],
   "charact": {
    "seg": 0,
    "offset": 23
   },
   "segments": [
    {
     "id": "claims/1/seg/0",
     "line": 2,
     "kind": "text",
     "text": "1.神经网络模型的可视化建模方法，其特征在于，为深度学习框架中的各个运算方法与各个对象/实例构建映射关系，并为各个所述对象/实例构建对应的可视化控件，并将输入输出关系映射为可视化有向弧，还包括：当接收到对至少一个所述可视化控件的操作时，根据操作的每一个所述可视化控件对应的对象/实例以及所述映射关系，确定节点集合；当接收到对至少一个所述可视化有向弧的操作时，根据操作的每一个所述可视化有向弧和所述输入输出关系，确定依赖关系集合；当接收到建模请求时，初始化预先构建的源码文件；基于所述深度学习框架和初始化后的所述源码文件，利用所述节点集合和所述依赖关系集合，生成对应的神经网络模型；所述对至少一个所述可视化控件的操作，包括：将一个可视化控件移入可识别区域，并为移入的所述可视化控件添加可视化参数；或者，将位于可识别区域中的一个可视化控件移出可识别区域，并删除移出的所述可视化控件对应的可视化参数；所述对至少一个所述可视化有向弧的操作，包括：在可视化区域中，任两个可视化控件之间绘制所述可视化有向弧，或者，删除绘制的可视化有向弧；进一步包括：定义节点集合V，V＝{vi|vi＝(type，params)}，其中，vi表征第i个节点；type表征第i个节点对应的运算方法；params表征第i个节点对应的参数；初始化所述节点集合为所述确定节点集合，包括：针对操作的每一个所述可视化控件执行下述N1至N3：N1：通过所述映射关系，在所述深度学习框架中，查找操作的所述可视化控件对应的对象/实例的运算方法，并利用操作的所述可视化控件对应的可视化参数与查找到的所述运算方法，将操作的所述可视化控件实例化为一个节点vm＝(typem，paramsm)，其中，vm表征操作的所述可视化控件实例化的第m个节点，m为不小于1的正整数；typem表征操作的所述可视化控件对应的运算方法；paramsm表征操作的所述可视化控件对应的可视化参数；N2：当所述操作为将一个可视化控件移入可识别区域，并为移入的所述可视化控件添加可视化参数时，确定当前节点集合Vm＝Vm‑1∪{vm}；N3：当所述操作为将一个可视化控件移出可识别区域，并删除移出的所述可视化控件对应的可视化参数时，确定当前节点集合Vm‑1＝Vm‑{vm}；进一步包括：定义有向弧集合E，其中，E＝{ek|ek＝(vp，vq)}，ek表征第k个有向弧；ek＝(vp，vq)表征v p为第k个有向弧起点连接的节点，vq为第k个有向弧的终点连接的节点，第k个有向弧构建出的依赖关系为第p个节点的输出为第q个节点的输入；初始化所述有向弧集合为所述确定依赖关系集合，包括：针对操作的每一个所述可视化有向弧执行下述M1至M4：M1：解析操作的所述可视化有向弧的起点连接的节点和操作的所述有向弧的终点连接的节点；M2：利用起点连接的所述节点和终点连接的所述节点，实例化操作的所述可视化有向弧，得到实例化的有向弧em＝(va，vb)，其中，em表征实例化的第m个有向弧，m为不小于1的正整数；va表征第m个实例化的有向弧的起点连接的节点；vb表征第m个实例化的有向弧的终点连接的节点；M3：当所述操作为绘制所述可视化有向弧时，确定当前依赖关系集合Em＝Em‑1∪{em}；M4：当所述操作为删除绘制的可视化有向弧时，确定当前依赖关系集合Em‑1＝Em‑{em}；进一步包括：确定神经网络模型的有向图G；G＝(V，E)，V＝{v1，…，vg}，E＝{e1，…，es}其中，g表征节点集合中节点的总个数，g为不小于1的正整数；s表征依赖关系集合中实例化的有向弧总个数，s为不小于0的正整数；所述利用所述节点集合和所述依赖关系集合，生成对应的神经网络模型，包括：循环执行下述D1至D7：D1：判断当前依赖关系集合是否为空，如果否，则执行D2；如果是，则执行D7；D2：从所述当前依赖关系集合中，检索出所有无前继的节点；D3：针对每一个无前继的所述节点，执行：从所述当前依赖关系集合中，检索所有的后继的节点；D4：为每一个后继的所述节点构建代码段code_snippet：β _output＝ β _function( α _output，β _params)其中，β _function表征节点 β 的运算方法在深度学习框架中对应的方法名；α _output表征节点 α 的输出变量，β _params表征 β _function对应的参数，β _output为节点 β 的输出变量；D5：将每一个后继的所述节点对应的代码段code_snippet顺序添加到所述源码文件尾部；D6：从所述当前依赖关系集合中，去除与D2和D3相关的依赖关系，成为新的依赖关系集合，并将新的依赖关系集合作为当前依赖关系集合，执行D1；D7：结束循环，确定添加有代码段code_snippet的源码文件为神经网络模型的代码文件。",
     "mathml": null,
     "inline": [
      {
       "text": "1.神经网络模型的可视化建模方法，其特征在于，为深度学习框架中的各个运算方法与各个对象/实例构建映射关系，并为各个所述对象/实例构建对应的可视化控件，并将输入输出关系映射为可视化有向弧，还包括：当接收到对至少一个所述可视化控件的操作时，根据操作的每一个所述可视化控件对应的对象/实例以及所述映射关系，确定节点集合；当接收到对至少一个所述可视化有向弧的操作时，根据操作的每一个所述可视化有向弧和所述输入输出关系，确定依赖关系集合；当接收到建模请求时，初始化预先构建的源码文件；基于所述深度学习框架和初始化后的所述源码文件，利用所述节点集合和所述依赖关系集合，生成对应的神经网络模型；所述对至少一个所述可视化控件的操作，包括：将一个可视化控件移入可识别区域，并为移入的所述可视化控件添加可视化参数；或者，将位于可识别区域中的一个可视化控件移出可识别区域，并删除移出的所述可视化控件对应的可视化参数；所述对至少一个所述可视化有向弧的操作，包括：在可视化区域中，任两个可视化控件之间绘制所述可视化有向弧，或者，删除绘制的可视化有向弧；进一步包括：定义节点集合V，V＝{vi|vi＝(type，params)}，其中，vi表征第i个节点；type表征第i个节点对应的运算方法；params表征第i个节点对应的参数；初始化所述节点集合为所述确定节点集合，包括：针对操作的每一个所述可视化控件执行下述N1至N3：N1：通过所述映射关系，在所述深度学习框架中，查找操作的所述可视化控件对应的对象/实例的运算方法，并利用操作的所述可视化控件对应的可视化参数与查找到的所述运算方法，将操作的所述可视化控件实例化为一个节点vm＝(typem，paramsm)，其中，vm表征操作的所述可视化控件实例化的第m个节点，m为不小于1的正整数；typem表征操作的所述可视化控件对应的运算方法；paramsm表征操作的所述可视化控件对应的可视化参数；N2：当所述操作为将一个可视化控件移入可识别区域，并为移入的所述可视化控件添加可视化参数时，确定当前节点集合Vm＝Vm‑1∪{vm}；N3：当所述操作为将一个可视化控件移出可识别区域，并删除移出的所述可视化控件对应的可视化参数时，确定当前节点集合Vm‑1＝Vm‑{vm}；进一步包括：定义有向弧集合E，其中，E＝{ek|ek＝(vp，vq)}，ek表征第k个有向弧；ek＝(vp，vq)表征v p为第k个有向弧起点连接的节点，vq为第k个有向弧的终点连接的节点，第k个有向弧构建出的依赖关系为第p个节点的输出为第q个节点的输入；初始化所述有向弧集合为所述确定依赖关系集合，包括：针对操作的每一个所述可视化有向弧执行下述M1至M4：M1：解析操作的所述可视化有向弧的起点连接的节点和操作的所述有向弧的终点连接的节点；M2：利用起点连接的所述节点和终点连接的所述节点，实例化操作的所述可视化有向弧，得到实例化的有向弧em＝(va，vb)，其中，em表征实例化的第m个有向弧，m为不小于1的正整数；va表征第m个实例化的有向弧的起点连接的节点；vb表征第m个实例化的有向弧的终点连接的节点；M3：当所述操作为绘制所述可视化有向弧时，确定当前依赖关系集合Em＝Em‑1∪{em}；M4：当所述操作为删除绘制的可视化有向弧时，确定当前依赖关系集合Em‑1＝Em‑{em}；进一步包括：确定神经网络模型的有向图G；G＝(V，E)，V＝{v1，…，vg}，E＝{e1，…，es}其中，g表征节点集合中节点的总个数，g为不小于1的正整数；s表征依赖关系集合中实例化的有向弧总个数，s为不小于0的正整数；所述利用所述节点集合和所述依赖关系集合，生成对应的神经网络模型，包括：循环执行下述D1至D7：D1：判断当前依赖关系集合是否为空，如果否，则执行D2；如果是，则执行D7；D2：从所述当前依赖关系集合中，检索出所有无前继的节点；D3：针对每一个无前继的所述节点，执行：从所述当前依赖关系集合中，检索所有的后继的节点；D4：为每一个后继的所述节点构建代码段code",
       "marks": []
      },
      {
       "text": "snippet",
       "marks": [
        "sub"
       ]
      },
      {
       "text": "：β ",
       "marks": []
      },
      {
       "text": "output",
       "marks": [
        "sub"
       ]
      },
      {
       "text": "＝ β ",
       "marks": []
      },
      {
       "text": "function",
       "marks": [
        "sub"
       ]
      },
      {
       "text": "( α ",
       "marks": []
      },
      {
       "text": "output",
       "marks": [
        "sub"
       ]
      },
      {
       "text": "，β ",
       "marks": []
      },
      {
       "text": "params",
       "marks": [
        "sub"
       ]
      },
      {
       "text": ")其中，β ",
       "marks": []
      },
      {
       "text": "function",
       "marks": [
        "sub"
       ]
      },
      {
       "text": "表征节点 β 的运算方法在深度学习框架中对应的方法名；α ",
       "marks": []
      },
      {
       "text": "output",
       "marks": [
        "sub"
       ]
      },
      {
       "text": "表征节点 α 的输出变量，β ",
       "marks": []
      },
      {
       "text": "params",
       "marks": [
        "sub"
       ]
      },
      {
       "text": "表征 β ",
       "marks": []
      },
      {
       "text": "function",
       "marks": [
        "sub"
       ]
      },
      {
       "text": "对应的参数，β ",
       "marks": []
      },
      {
       "text": "output",
       "marks": [
        "sub"
       ]
      },
      {
       "text": "为节点 β 的输出变量；D5：将每一个后继的所述节点对应的代码段code",
       "marks": []
      },
      {
       "text": "snippet",
       "marks": [
        "sub"
       ]
      },
      {
       "text": "顺序添加到所述源码文件尾部；D6：从所述当前依赖关系集合中，去除与D2和D3相关的依赖关系，成为新的依赖关系集合，并将新的依赖关系集合作为当前依赖关系集合，执行D1；D7：结束循环，确定添加有代码段code",
       "marks": []
      },
      {
       "text": "snippet",
       "marks": [
        "sub"
       ]
      },
      {
       "text": "的源码文件为神经网络模型的代码文件。",
       "marks": []
      }
     ]
    }
   ]
  }
 ],
 "description": [
  {
   "id": "description/技术领域",
   "kind": "section",
   "lines": {
    "start": 2,
    "end": 2
   },
   "title": "技术领域",
   "part": "technical-field",
   "inline": [
    {
     "text": "技术领域",
     "marks": []
    }
   ]
  },
  {
   "id": "description/技术领域/p0001",
   "kind": "paragraph",
   "lines": {
    "start": 4,
    "end": 4
   },
   "text": "[0001] 本发明涉及计算机技术领域，特别涉及神经网络模型的可视化建模方法和装置。",
   "para_no": 1,
   "role": "body",
   "inline": [
    {
     "text": "[0001] 本发明涉及计算机技术领域，特别涉及神经网络模型的可视化建模方法和装置。",
     "marks": []
    }
   ]
  },
  {
   "id": "description/背景技术",
   "kind": "section",
   "lines": {
    "start": 6,
    "end": 6
   },
   "title": "背景技术",
   "part": "background-art",
   "inline": [
    {
     "text": "背景技术",
     "marks": []
    }
   ]
  }
 ],
 "figures": [
  {
   "id": "figures/1",
   "kind": "figure",
   "book": "figures",
   "num": 1,
   "file": "fig1.png",
   "width": 15.0,
   "alt": "图1 本发明一个实施例提供的神经网络模型的可视化建模方法的流程图",
   "caption": null,
   "caption_line": null
  }
 ]
}
